{"$schema":"https://json-schema.org/draft/2020-12/schema","type":"object","additionalProperties":false,"required":["protocol","action","predecessor_plan_sha256","successor_plan_sha256","node_correspondence","budget_carryover","authorizing_decision"],"properties":{"protocol":{"const":"plan-graph-version-transition/1"},"action":{"enum":["revise_acceptance","revise_functionality","accept_contract_deviation"]},"predecessor_plan_sha256":{"type":"string","pattern":"^[0-9a-f]{64}$"},"successor_plan_sha256":{"type":"string","pattern":"^[0-9a-f]{64}$"},"node_correspondence":{"type":"object","additionalProperties":{"type":"string"}},"budget_carryover":{"type":"object","additionalProperties":{"enum":["full","reset"]}},"authorizing_decision":{"$ref":"recovery-decision.json"}}}
