{"action":"revise_acceptance","authorizing_decision":{"action":"revise_acceptance","expected_prior_digest":"aaaaaaaaaaaaaaaaaaaaaaaaaaaaaaaaaaaaaaaaaaaaaaaaaaaaaaaaaaaaaaaa","payload":{},"protocol":"plan-graph-recovery-decision/1","target":"plan_version"},"budget_carryover":{"RB-05":"full"},"node_correspondence":{"RB-05":"RB-05"},"predecessor_plan_sha256":"aaaaaaaaaaaaaaaaaaaaaaaaaaaaaaaaaaaaaaaaaaaaaaaaaaaaaaaaaaaaaaaa","protocol":"plan-graph-version-transition/1","successor_plan_sha256":"bbbbbbbbbbbbbbbbbbbbbbbbbbbbbbbbbbbbbbbbbbbbbbbbbbbbbbbbbbbbbbbb"}
